{
  "$schema": "https://json-schema.org/draft/2020-12/schema",
  "title": "Race walking session metadata",
  "type": "object",
  "required": ["athlete_name", "camera_view"],
  "additionalProperties": false,
  "properties": {
    "athlete_name": {"type": "string", "minLength": 1},
    "age": {"type": ["integer", "null"], "minimum": 5, "maximum": 100},
    "gender": {"type": ["string", "null"], "enum": ["Male", "Female", "Other", null]},
    "level": {"type": ["string", "null"], "enum": ["beginner", "intermediate", "advanced", "elite", null],
              "description": "Athlete level. Never assumed: if null the report says it was NOT PROVIDED."},
    "discipline": {"type": ["string", "null"], "description": "For example 20 km race walk."},
    "setting": {"type": ["string", "null"], "enum": ["treadmill", "track", "road", "gym", "other", null]},
    "camera_view": {
      "type": "string",
      "enum": ["rear", "front", "side_left", "side_right", "oblique"],
      "description": "Where the camera is relative to the athlete. side_left means the athlete's left side faces the camera. Side views are needed for a definitive straight-leg assessment."
    },
    "camera_distance_m": {"type": ["number", "null"], "exclusiveMinimum": 0},
    "treadmill_speed_kmh": {
      "type": ["number", "null"], "exclusiveMinimum": 0,
      "description": "Belt speed. Pace and step length are reported ONLY when this or distance_walked_m is supplied; they are never estimated from the picture. Takes priority over distance_walked_m if both are set."
    },
    "distance_walked_m": {
      "type": ["number", "null"], "exclusiveMinimum": 0,
      "description": "Distance the athlete covered over the whole video, in metres, set via `racewalk init-session --distance-m`. Used to compute average speed (distance / clip duration) when treadmill_speed_kmh is not supplied. Never estimated."
    },
    "body_mass_kg": {"type": ["number", "null"], "exclusiveMinimum": 0,
                     "description": "Used only to scale the generic nutrition guidance in Section 8."},
    "session_date": {"type": ["string", "null"], "pattern": "^[0-9]{4}-[0-9]{2}-[0-9]{2}$"},
    "declared_frame_rate": {"type": ["number", "null"],
                            "description": "What the operator believes the capture rate was. The report always uses the MEASURED rate from S0 and flags any disagreement."},
    "additional_data": {"type": "array", "items": {"type": "string"}},
    "notes": {"type": ["string", "null"]},
    "manual_event_overrides": {
      "type": ["object", "null"],
      "description": "Optional escape hatch. Maps a leg (L or R) to a list of [heel_strike_s, toe_off_s] pairs in seconds. Overrides S4 detection and is recorded as such in the report."
    },
    "wearables": {
      "type": ["object", "null"],
      "additionalProperties": false,
      "properties": {
        "gps_file": {"type": ["string", "null"]},
        "heart_rate_file": {"type": ["string", "null"]},
        "imu_file": {"type": ["string", "null"]}
      }
    }
  }
}
